<?xml version="1.0" encoding="UTF-8"?>
<!DOCTYPE category SYSTEM "../../rasterix.dtd">
<category id="1">
    <item id="100" frn="1">
        <compound>
            <fixed bytes="1">
                <field name="f1" bits="8"/>
            </fixed>
            <explicit bytes="2">
                <field name="f2" bits="16"/>
            </explicit>
            <extended bytes="1">
                <part index="0">
                    <field name="f3" bits="7"/>
                </part>
            </extended>
            <repetitive bytes="1" counter="2">
                <field name="f4" bits="8"/>
            </repetitive>
        </compound>
    </item>
</category>