<?xml version="1.0" encoding="UTF-8"?>
<!DOCTYPE category SYSTEM "../../rasterix.dtd">
<category id="48">
    <item id="20" frn="1">
        <extended bytes="2">
            <part index="0">
                <field name="data" bits="3"/>
                <spare bits="4"/>
            </part>
            <part index="1">
                <field name="data" bits="5"/>  <!-- OK: different part scope -->
                <spare bits="2"/>
            </part>
        </extended>
    </item>
</category>