<?xml version="1.0" encoding="UTF-8"?>
<!DOCTYPE category SYSTEM "../../rasterix.dtd">
<category id="1">
    <item id="80" frn="1">
        <repetitive bytes="2" counter="3">
            <epb>
                <enum name="status" bits="2">
                    <value name="OK" value="0"/>
                    <value name="ERROR" value="1"/>
                </enum>
            </epb>
            <field name="data" bits="12"/>
            <spare bits="1"/>
        </repetitive>
    </item>
</category>