<?xml version="1.0" encoding="UTF-8"?>
<!DOCTYPE category SYSTEM "../../rasterix.dtd">
<category id="1">
    <item id="120" frn="1">
        <fixed bytes="4">
            <field name="field1" bits="4"/>
            <epb>
                <enum name="quality" bits="3">
                    <value name="HIGH" value="0"/>
                    <value name="LOW" value="1"/>
                </enum>
            </epb>
            <spare bits="1"/>
            <enum name="type_field" bits="2">
                <value name="A" value="0"/>
                <value name="B" value="1"/>
            </enum>
            <field name="field2" bits="12"/>
            <epb>
                <field name="opt" bits="8"/>
            </epb>
        </fixed>
    </item>
</category>