<?xml version="1.0" encoding="UTF-8"?>
<!DOCTYPE category SYSTEM "../../rasterix.dtd">
<category id="48">
    <item id="20" frn="1">
        <extended bytes="3">
            <part index="0">
                <field name="a" bits="3"/>
                <field name="b" bits="4"/>
            </part>
            <part index="1">
                <field name="c" bits="5"/>
                <spare bits="2"/>
            </part>
            <part index="2">
                <field name="d" bits="5"/>
                <spare bits="2"/>
            </part>
        </extended>
    </item>
</category>